{
  "schema_version": "1.0.0",
  "contract_type": "WorkflowPlan",
  "workflow_id": "wf_01",
  "correlation_id": "corr_01",
  "causation_id": "evt_01",
  "timestamp_utc": "2026-04-08T10:16:00Z",
  "originator": {
    "type": "agent",
    "id": "orchestrator_agent_v1"
  },
  "environment": "paper",
  "operating_mode": "MODE-001",
  "payload": {
    "plan_id": "plan_01",
    "selected_pattern": "sequential_review",
    "phase_steps": [
      {
        "phase": "reason",
        "owner": "strategy_agent",
        "goal": "review trade setup"
      },
      {
        "phase": "verify",
        "owner": "risk_governor_agent",
        "goal": "validate constraints"
      }
    ],
    "assigned_agents": [
      "strategy_agent",
      "risk_governor_agent"
    ],
    "tool_permissions": {
      "strategy_agent": ["market_data_mcp", "sql_mcp"],
      "risk_governor_agent": ["risk_analytics_mcp", "sql_mcp"]
    },
    "success_conditions": [
      "proposal_created",
      "risk_gate_passed"
    ],
    "escalation_conditions": [
      "missing_required_snapshot",
      "policy_denial"
    ]
  }
}
