{
  "schema_version": "1.0.0",
  "workflow_id": "wf_01",
  "correlation_id": "corr_01",
  "causation_id": "evt_01",
  "timestamp_utc": "2026-04-08T10:15:30Z",
  "originator": {
    "type": "agent",
    "id": "planner_agent"
  },
  "environment": "paper",
  "operating_mode": "MODE-001",
  "contract_type": "WorkflowPlan",
  "payload": {
    "plan_id": "plan_01",
    "selected_pattern": "sequential_review",
    "phase_steps": [
      {
        "phase": "reason",
        "owner_agent": "strategy_agent",
        "expected_output_contract_type": "TradeHypothesis"
      },
      {
        "phase": "risk",
        "owner_agent": "risk_agent",
        "expected_output_contract_type": "RiskAssessmentDecision"
      }
    ]
  }
}